{
    "$schema": "https://cookbook.meridianhub.org/schema/registry-item.json",
    "name": "direction-badge",
    "type": "registry:ui",
    "title": "Direction Badge",
    "description": "Displays a double-entry bookkeeping direction (DEBIT or CREDIT) as a colour-coded inline badge. DEBIT renders in orange and CREDIT in blue, following standard accounting colour conventions.",
    "categories": ["ledger", "badge", "display", "accounting"],
    "files": [
        {
            "path": "frontend/src/pages/ledger/direction-badge.tsx",
            "type": "registry:ui"
        }
    ],
    "meta": {
        "feature_module": "ledger",
        "tenant_configurable": false,
        "used_by": ["ledger", "transactions", "audit"]
    }
}
